{
  "action_type": "data_export",
  "destination_region": "US",
  "source_region": "EU",
  "contains_pii": true,
  "purpose": "analytics",
  "data_categories": ["email", "name"],
  "payload": {
    "email": "bob@example.de",
    "name": "Bob Mueller",
    "records": 42
  },
  "actor": "agent-export-02"
}
